[
  {
    "patient_id": "P001",
    "visit_date": "2025-09-14",
    "visit_time": "11:15",
    "age": 57,
    "sex": "F",
    "complaints": [
      {
        "symptom": "sore throat",
        "details": "sore throat reported for 3 days",
        "priority": 1
      },
      {
        "symptom": "rash",
        "details": "rash reported for 8 days",
        "priority": 2
      },
      {
        "symptom": "joint pain",
        "details": "joint pain reported for 4 days",
        "priority": 3
      }
    ],
    "history_of_present_illness": "Patient reports gradual onset of symptoms with variable intensity.",
    "medical_history": {
      "allergies": [],
      "family_history": "none",
      "current_medications": [],
      "past_infections": [
        "chickenpox"
      ],
      "tuberculosis": "no",
      "std": "yes",
      "hepatitis": "no",
      "hiv": "positive",
      "infectious_contacts": "no",
      "chronic_conditions": [
        "hypertension",
        "asthma",
        "iron deficiency anemia"
      ],
      "hospitalizations": [
        "2020 - bypass surgery"
      ],
      "blood_transfusion": "no"
    },
    "status_praesens": {
      "general_condition": "satisfactory",
      "consciousness": "confused",
      "speech": "slurred",
      "hearing": "normal",
      "vision": "impaired",
      "activity": "limited",
      "constitution": "normal",
      "emotional_status": "anxious",
      "sleep": "normal",
      "appetite": "increased"
    },
    "skin_and_mucosa": {
      "temperature": 38.5,
      "mucosa": "dry",
      "pharynx": "normal",
      "skin": "rash",
      "lymph_nodes": "enlarged, tender"
    },
    "respiratory_system": {
      "breathing_type": "mixed",
      "respiratory_rate": 16,
      "auxiliary_muscles": false,
      "cough": "productive",
      "sputum": "clear",
      "auscultation": "vesicular breath sounds"
    },
    "cardiovascular_system": {
      "blood_pressure": "118/63",
      "pulse": "94 regular",
      "heart_rate": 89,
      "edema": "none",
      "heart_sounds": "normal",
      "heart_murmurs": "present"
    },
    "digestive_system": {
      "tongue": "dry",
      "symptoms": [
        "constipation",
        "heartburn"
      ],
      "abdomen": "soft",
      "liver": "enlarged",
      "stool": "constipation"
    },
    "urinary_system": {
      "urination": "normal",
      "incontinence": "no",
      "percussion": "non-tender"
    },
    "status_localis": "No focal pathological findings."
  },
  {
    "patient_id": "P002",
    "visit_date": "2025-09-18",
    "visit_time": "10:30",
    "age": 56,
    "sex": "F",
    "complaints": [
      {
        "symptom": "shortness of breath",
        "details": "shortness of breath reported for 3 days",
        "priority": 1
      },
      {
        "symptom": "fatigue",
        "details": "fatigue reported for 2 days",
        "priority": 2
      }
    ],
    "history_of_present_illness": "Patient reports gradual onset of symptoms with variable intensity.",
    "medical_history": {
      "allergies": [],
      "family_history": "heart disease",
      "current_medications": [
        "omeprazole"
      ],
      "past_infections": [
        "chickenpox"
      ],
      "tuberculosis": "no",
      "std": "no",
      "hepatitis": "yes",
      "hiv": "negative",
      "infectious_contacts": "yes",
      "chronic_conditions": [],
      "hospitalizations": [
        "2006 - bypass surgery"
      ],
      "blood_transfusion": "no"
    },
    "status_praesens": {
      "general_condition": "satisfactory",
      "consciousness": "drowsy",
      "speech": "normal",
      "hearing": "normal",
      "vision": "impaired",
      "activity": "preserved",
      "constitution": "normal",
      "emotional_status": "apathetic",
      "sleep": "normal",
      "appetite": "decreased"
    },
    "skin_and_mucosa": {
      "temperature": 39.4,
      "mucosa": "moist",
      "pharynx": "hyperemic",
      "skin": "pale",
      "lymph_nodes": "enlarged, tender"
    },
    "respiratory_system": {
      "breathing_type": "abdominal",
      "respiratory_rate": 28,
      "auxiliary_muscles": true,
      "cough": "productive",
      "sputum": "clear",
      "auscultation": "vesicular breath sounds"
    },
    "cardiovascular_system": {
      "blood_pressure": "113/61",
      "pulse": "93 regular",
      "heart_rate": 64,
      "edema": "ankle edema",
      "heart_sounds": "normal",
      "heart_murmurs": "absent"
    },
    "digestive_system": {
      "tongue": "coated",
      "symptoms": [],
      "abdomen": "tense",
      "liver": "tender",
      "stool": "normal"
    },
    "urinary_system": {
      "urination": "frequent",
      "incontinence": "no",
      "percussion": "non-tender"
    },
    "status_localis": "No focal pathological findings."
  },
  {
    "patient_id": "P003",
    "visit_date": "2025-09-20",
    "visit_time": "16:45",
    "age": 33,
    "sex": "M",
    "complaints": [
      {
        "symptom": "cough",
        "details": "cough reported for 5 days",
        "priority": 1
      }
    ],
    "history_of_present_illness": "Patient reports gradual onset of symptoms with variable intensity.",
    "medical_history": {
      "allergies": [],
      "family_history": "hypertension",
      "current_medications": [
        "lisinopril",
        "metformin"
      ],
      "past_infections": [
        "chickenpox"
      ],
      "tuberculosis": "yes",
      "std": "no",
      "hepatitis": "yes",
      "hiv": "negative",
      "infectious_contacts": "yes",
      "chronic_conditions": [],
      "hospitalizations": [
        "2009 - none"
      ],
      "blood_transfusion": "no"
    },
    "status_praesens": {
      "general_condition": "moderate",
      "consciousness": "confused",
      "speech": "slurred",
      "hearing": "reduced",
      "vision": "normal",
      "activity": "bedridden",
      "constitution": "hypersthenic",
      "emotional_status": "anxious",
      "sleep": "normal",
      "appetite": "decreased"
    },
    "skin_and_mucosa": {
      "temperature": 38.6,
      "mucosa": "moist",
      "pharynx": "normal",
      "skin": "cyanotic",
      "lymph_nodes": "enlarged, tender"
    },
    "respiratory_system": {
      "breathing_type": "mixed",
      "respiratory_rate": 18,
      "auxiliary_muscles": false,
      "cough": "dry",
      "sputum": "none",
      "auscultation": "reduced breath sounds with crackles"
    },
    "cardiovascular_system": {
      "blood_pressure": "139/72",
      "pulse": "81 regular",
      "heart_rate": 92,
      "edema": "none",
      "heart_sounds": "normal",
      "heart_murmurs": "absent"
    },
    "digestive_system": {
      "tongue": "coated",
      "symptoms": [],
      "abdomen": "tense",
      "liver": "enlarged",
      "stool": "melena"
    },
    "urinary_system": {
      "urination": "frequent",
      "incontinence": "no",
      "percussion": "tender"
    },
    "status_localis": "No focal pathological findings."
  },
  {
    "patient_id": "P004",
    "visit_date": "2025-09-10",
    "visit_time": "17:45",
    "age": 64,
    "sex": "M",
    "complaints": [
      {
        "symptom": "shortness of breath",
        "details": "shortness of breath reported for 6 days",
        "priority": 1
      },
      {
        "symptom": "rash",
        "details": "rash reported for 5 days",
        "priority": 2
      },
      {
        "symptom": "cough",
        "details": "cough reported for 3 days",
        "priority": 3
      }
    ],
    "history_of_present_illness": "Patient reports gradual onset of symptoms with variable intensity.",
    "medical_history": {
      "allergies": [],
      "family_history": "cancer",
      "current_medications": [
        "omeprazole"
      ],
      "past_infections": [
        "hepatitis A"
      ],
      "tuberculosis": "no",
      "std": "no",
      "hepatitis": "no",
      "hiv": "positive",
      "infectious_contacts": "no",
      "chronic_conditions": [
        "coronary artery disease"
      ],
      "hospitalizations": [
        "2006 - appendectomy"
      ],
      "blood_transfusion": "no"
    },
    "status_praesens": {
      "general_condition": "satisfactory",
      "consciousness": "drowsy",
      "speech": "slurred",
      "hearing": "reduced",
      "vision": "impaired",
      "activity": "limited",
      "constitution": "asthenic",
      "emotional_status": "anxious",
      "sleep": "normal",
      "appetite": "increased"
    },
    "skin_and_mucosa": {
      "temperature": 36.5,
      "mucosa": "moist",
      "pharynx": "normal",
      "skin": "cyanotic",
      "lymph_nodes": "enlarged, tender"
    },
    "respiratory_system": {
      "breathing_type": "thoracic",
      "respiratory_rate": 14,
      "auxiliary_muscles": false,
      "cough": "none",
      "sputum": "greenish",
      "auscultation": "vesicular breath sounds"
    },
    "cardiovascular_system": {
      "blood_pressure": "116/88",
      "pulse": "88 regular",
      "heart_rate": 86,
      "edema": "none",
      "heart_sounds": "muffled",
      "heart_murmurs": "absent"
    },
    "digestive_system": {
      "tongue": "moist",
      "symptoms": [],
      "abdomen": "tender",
      "liver": "tender",
      "stool": "normal"
    },
    "urinary_system": {
      "urination": "frequent",
      "incontinence": "no",
      "percussion": "non-tender"
    },
    "status_localis": "No focal pathological findings."
  },
  {
    "patient_id": "P005",
    "visit_date": "2025-09-14",
    "visit_time": "11:15",
    "age": 56,
    "sex": "F",
    "complaints": [
      {
        "symptom": "memory loss",
        "details": "memory loss reported for 4 days",
        "priority": 1
      },
      {
        "symptom": "back pain",
        "details": "back pain reported for 9 days",
        "priority": 2
      }
    ],
    "history_of_present_illness": "Patient reports gradual onset of symptoms with variable intensity.",
    "medical_history": {
      "allergies": [
        "none"
      ],